{
  "schema": "ophiolite.application-curve/1",
  "representation": "normalized",
  "axis": [
    100.0,
    101.0,
    102.0,
    103.0,
    104.0
  ],
  "values": [
    0.0,
    10.0,
    null,
    30.0,
    40.0
  ],
  "curve": "GR",
  "unit": "gAPI",
  "context": {
    "depth_index": "DEPT",
    "depth_unit": "M",
    "depth_reference": "source declared; not inferred",
    "missing_value_marker": "-999.25",
    "missing_value_policy": "Declared LAS NULL marker; missing samples are not zero"
  },
  "source": {
    "authority": "synthetic-file",
    "key": "curve-a",
    "revision": "d899416c42214983308a6feec77a5f94e6d391665dd228d91957393b37caf56b",
    "profile": "las2/1"
  },
  "source_sha256": "d899416c42214983308a6feec77a5f94e6d391665dd228d91957393b37caf56b",
  "interpretation": {
    "reader": "asset_connectors.las_reader/1",
    "lasio_version": "0.32",
    "mapping": "application-curve/1",
    "null_policy": "strict declared NULL; nonfinite samples mapped to null; wrapped rows use declared curve count",
    "parsing_policy": "las2-strict-null/1"
  }
}
